{
  "version": "20260916-4.0",
  "generated": "2026-09-16T14:22:06Z",
  "count": 548,
  "relationships": [
    {
      "id": "BM000001",
      "bioactive": "DF001",
      "mechanism": "MEC030",
      "strength": 5,
      "confidence": "High",
      "notes": "Relationship explicitly identified in the curation as an evidence-supported mechanism for Beta-glucan.",
      "references": [
        "Scientific Literature"
      ]
    },
    {
      "id": "BM000002",
      "bioactive": "DF001",
      "mechanism": "MEC031",
      "strength": 5,
      "confidence": "High",
      "notes": "Relationship explicitly identified in the curation as an evidence-supported mechanism for Beta-glucan.",
      "references": [
        "Scientific Literature"
      ]
    },
    {
      "id": "BM000003",
      "bioactive": "DF001",
      "mechanism": "MEC032",
      "strength": 4,
      "confidence": "Moderate",
      "notes": "Relationship explicitly identified in the curation as an evidence-supported mechanism for Beta-glucan.",
      "references": [
        "Scientific Literature"
      ]
    },
    {
      "id": "BM000004",
      "bioactive": "DF001",
      "mechanism": "MEC033",
      "strength": 5,
      "confidence": "High",
      "notes": "Relationship explicitly identified in the curation as an evidence-supported mechanism for Beta-glucan.",
      "references": [
        "Scientific Literature"
      ]
    },
    {
      "id": "BM000005",
      "bioactive": "DF001",
      "mechanism": "MEC036",
      "strength": 4,
      "confidence": "Moderate",
      "notes": "Relationship explicitly identified in the curation as an evidence-supported mechanism for Beta-glucan.",
      "references": [
        "Scientific Literature"
      ]
    },
    {
      "id": "BM000006",
      "bioactive": "DF001",
      "mechanism": "MEC037",
      "strength": 3,
      "confidence": "Moderate",
      "notes": "Relationship explicitly identified in the curation as an evidence-supported mechanism for Beta-glucan.",
      "references": [
        "Scientific Literature"
      ]
    },
    {
      "id": "BM000007",
      "bioactive": "DF001",
      "mechanism": "MEC038",
      "strength": 4,
      "confidence": "Moderate",
      "notes": "Relationship explicitly identified in the curation as an evidence-supported mechanism for Beta-glucan.",
      "references": [
        "Scientific Literature"
      ]
    },
    {
      "id": "BM000008",
      "bioactive": "DF001",
      "mechanism": "MEC001",
      "strength": 5,
      "confidence": "High",
      "notes": "Curation explicitly maps Beta-glucan to this circulatory mechanism.",
      "references": [
        "Scientific Literature"
      ]
    },
    {
      "id": "BM000009",
      "bioactive": "DF001",
      "mechanism": "MEC002",
      "strength": 5,
      "confidence": "High",
      "notes": "Curation explicitly maps Beta-glucan to this circulatory mechanism.",
      "references": [
        "Scientific Literature"
      ]
    },
    {
      "id": "BM000010",
      "bioactive": "DF001",
      "mechanism": "MEC006",
      "strength": 5,
      "confidence": "High",
      "notes": "Curation explicitly maps Beta-glucan to this circulatory mechanism.",
      "references": [
        "Scientific Literature"
      ]
    },
    {
      "id": "BM000011",
      "bioactive": "DF002",
      "mechanism": "MEC030",
      "strength": 5,
      "confidence": "High",
      "notes": "Primary action and description.",
      "references": [
        "Scientific Literature"
      ]
    },
    {
      "id": "BM000012",
      "bioactive": "DF002",
      "mechanism": "MEC031",
      "strength": 5,
      "confidence": "High",
      "notes": "Scientific summary explicitly states SCFA production.",
      "references": [
        "Scientific Literature"
      ]
    },
    {
      "id": "BM000013",
      "bioactive": "DF002",
      "mechanism": "MEC032",
      "strength": 4,
      "confidence": "Moderate",
      "notes": "Downstream effect of SCFA production.",
      "references": [
        "Scientific Literature"
      ]
    },
    {
      "id": "BM000014",
      "bioactive": "DF002",
      "mechanism": "MEC033",
      "strength": 4,
      "confidence": "High",
      "notes": "Soluble fermentable fibre supports healthy bowel function.",
      "references": [
        "Scientific Literature"
      ]
    },
    {
      "id": "BM000015",
      "bioactive": "DF002",
      "mechanism": "MEC035",
      "strength": 5,
      "confidence": "High",
      "notes": "Explicit support for beneficial intestinal bacteria.",
      "references": [
        "Scientific Literature"
      ]
    },
    {
      "id": "BM000016",
      "bioactive": "DF002",
      "mechanism": "MEC036",
      "strength": 4,
      "confidence": "Moderate",
      "notes": "Expected result of SCFA production.",
      "references": [
        "Scientific Literature"
      ]
    },
    {
      "id": "BM000017",
      "bioactive": "DF002",
      "mechanism": "MEC001",
      "strength": 4,
      "confidence": "Moderate",
      "notes": "Consistent with soluble fibre effects.",
      "references": [
        "Scientific Literature"
      ]
    },
    {
      "id": "BM000018",
      "bioactive": "DF002",
      "mechanism": "MEC002",
      "strength": 5,
      "confidence": "High",
      "notes": "Explicit primary action.",
      "references": [
        "Scientific Literature"
      ]
    },
    {
      "id": "BM000019",
      "bioactive": "DF002",
      "mechanism": "MEC006",
      "strength": 4,
      "confidence": "Moderate",
      "notes": "Supported through cholesterol-lowering mechanism.",
      "references": [
        "Scientific Literature"
      ]
    },
    {
      "id": "BM000020",
      "bioactive": "DF003",
      "mechanism": "MEC030",
      "strength": 5,
      "confidence": "High",
      "notes": "Primary action explicitly states selective stimulation of beneficial microbiota.",
      "references": [
        "Scientific Literature"
      ]
    },
    {
      "id": "BM000021",
      "bioactive": "DF003",
      "mechanism": "MEC031",
      "strength": 5,
      "confidence": "High",
      "notes": "Explicitly stated in the scientific summary.",
      "references": [
        "Scientific Literature"
      ]
    },
    {
      "id": "BM000022",
      "bioactive": "DF003",
      "mechanism": "MEC032",
      "strength": 4,
      "confidence": "Moderate",
      "notes": "Plausible downstream effect of increased SCFA production.",
      "references": [
        "Scientific Literature"
      ]
    },
    {
      "id": "BM000023",
      "bioactive": "DF003",
      "mechanism": "MEC035",
      "strength": 5,
      "confidence": "High",
      "notes": "Directly supported by the description of beneficial microbiota.",
      "references": [
        "Scientific Literature"
      ]
    },
    {
      "id": "BM000024",
      "bioactive": "DF003",
      "mechanism": "MEC036",
      "strength": 4,
      "confidence": "Moderate",
      "notes": "Consistent with SCFA production and fermentation.",
      "references": [
        "Scientific Literature"
      ]
    },
    {
      "id": "BM000025",
      "bioactive": "DF003",
      "mechanism": "MEC039",
      "strength": 3,
      "confidence": "Moderate",
      "notes": "Repository states support for digestive wellbeing; this is a reasonable but less direct mapping.",
      "references": [
        "Scientific Literature"
      ]
    },
    {
      "id": "BM000026",
      "bioactive": "DF004",
      "mechanism": "MEC030",
      "strength": 5,
      "confidence": "High",
      "notes": "Primary prebiotic substrate for colonic bacteria.",
      "references": [
        "Scientific Literature"
      ]
    },
    {
      "id": "BM000027",
      "bioactive": "DF004",
      "mechanism": "MEC031",
      "strength": 5,
      "confidence": "High",
      "notes": "Strong evidence for fermentation to butyrate and other SCFAs.",
      "references": [
        "Scientific Literature"
      ]
    },
    {
      "id": "BM000028",
      "bioactive": "DF004",
      "mechanism": "MEC032",
      "strength": 5,
      "confidence": "High",
      "notes": "Strong downstream effect, particularly through butyrate production.",
      "references": [
        "Scientific Literature"
      ]
    },
    {
      "id": "BM000029",
      "bioactive": "DF004",
      "mechanism": "MEC033",
      "strength": 5,
      "confidence": "High",
      "notes": "Well-established effect on stool bulk and colonic transit.",
      "references": [
        "Scientific Literature"
      ]
    },
    {
      "id": "BM000030",
      "bioactive": "DF004",
      "mechanism": "MEC035",
      "strength": 5,
      "confidence": "High",
      "notes": "Consistently increases beneficial microbial populations.",
      "references": [
        "Scientific Literature"
      ]
    },
    {
      "id": "BM000031",
      "bioactive": "DF004",
      "mechanism": "MEC036",
      "strength": 4,
      "confidence": "High",
      "notes": "Fermentation lowers colonic pH through SCFA production.",
      "references": [
        "Scientific Literature"
      ]
    },
    {
      "id": "BM000032",
      "bioactive": "DF004",
      "mechanism": "MEC038",
      "strength": 5,
      "confidence": "High",
      "notes": "Butyrate is the preferred fuel for colonocytes, supporting mucosal integrity.",
      "references": [
        "Scientific Literature"
      ]
    },
    {
      "id": "BM000033",
      "bioactive": "DF005",
      "mechanism": "MEC030",
      "strength": 5,
      "confidence": "High",
      "notes": "Explicitly described as a prebiotic supporting the gut microbiome.",
      "references": [
        "Scientific Literature"
      ]
    },
    {
      "id": "BM000034",
      "bioactive": "DF005",
      "mechanism": "MEC031",
      "strength": 4,
      "confidence": "Moderate",
      "notes": "Microbial fermentation produces beneficial metabolites, including SCFAs.",
      "references": [
        "Scientific Literature"